text,label
"This is one of the 3 bedrooms in the outstanding loft! It is very cozy and perfect for one person.However there is space for an air bed if more people are interested. Very typical for LIFE in a LOFT- THIS room is CONNECTED to another room but both rooms have their own doors!!THIS room has also a specific room divider in order to sustain privacy! The upper level is another extra which allows you to relax, read or just observe the streets of downtown LA. At the end of the world famous St. Vincent Court, in the St. Vincent Lofts lies one of LA's most gorgeous contemporary lofts. Spacious open loft with cool upstairs crawl space/room. Some of the most awesome views in Downtown. Secure building, great community full of artists, actors, musicians, young professionals and creative individuals.",3
"Our beautiful apartment is right in the heart of Columbus Circle outside the Time Warner Center. We are right across the street from the subway with access to the 1,A,B,C,D trains. Our apartment is very spacious. Both our bedroom and living room have huge windows which lets in lots of light. Our living room has a desktop Mac computer, TV, keyboard, couch, kitchen, coffee table and a small kitchen table. Our bedroom has a Queen size bed and a TV. Yes, we have cable :) @",1
"A quiet, comfortable home, near enough for convenience, far enough for calm. Five minutes to shopping, 15 to downtown, outside most of the congestion. This listing is for one bedroom with a shared bath. @",0
"Welcome to 1600 Vine apartments. Close to Walk of Fame, Hollywood shopping and nightlife, The W Hotel, Kodak theater, Pantages theater, The Bowl, Sunset Strip and Universal Studios. Couples, solo adventurers, business travelers will find our hotel like apartment simple and comfortable with full kitchen and other amenities. My goal is to provide travelers with reliable and comfortable place to rest with a kitchen, more space and great amenities. Stay at our hotel like accommodations and explore this beautiful city. Here is what we have to offer. >> VIEW to the street, panoramic >> POOL is available. GYM is available. >> WASHER/DRYER inside the unit. >> TV in each bedroom and living room. Smart, no cable. Netflix provided.  >> WiFi is provided for free. >> PARKING is complimentary. >> BED in the bedroom is queen size with new comfortable memory foam mattress and pillows.  >> AMENITIES provided: linen, 1 bath 1 hand towel per person, shampoo 2in1, soap, toilet paper, hairdryer, iron, dish soap, basic cookware/dishware, coffee maker, teapot. Not provided: paper towels, tea towels, flip-flops, coffee, bathmats, toothpaste, laundry detergent. >> LOCATION as any large city is very busy, lots of traffic, expect average city noise and city parties, lots of police to keep you safe. Besides all the great restaurant",0
"Flash deal only available for single night stays when I have a calendar opening. See my other listing for the regular bookings. Extensively remodeled in 2012 and boasts hardwood floors, open floor plan with city views and is light and bright throughout. Gourmet kitchen features quartz stone counters, cherry cabinets, Carrera backsplash, stainless appliances. The living area flows nicely to two generous bedrooms and one shared stone tiled bath. Private room is designed with modern furniture - full sized bed, desk, and sitting area with an amazing downtown view. Bed has 500 thread count linens, hypoallergenic down comforters and a memory foam pillow top mattress active spring coil mattress. You'll be sleeping like a king! There is an optional twin sized floor mattress for a 3rd guest or if you don't want share a bed with your +1. The room might be a little cozy, but it could be reminiscent of childhood sleep overs. The room is about roughly 100 sq ft or 9.29 sq meters.",2
"Enjoy the summer in this great 1 bedroom apartment with 2 queen beds located 4 min walking distance to the beach. This bright one bedroom is ready for you to enjoy the sun this summer, with amazing amenities, in the heart of all the action, yet relaxing the perfect balance for your vacation or brief get away. Beach-ready and amenity-packed at a great value for your next short or long term stay in West Los Angeles. Conveniently located two blocks from Venice Beach, 10 minutes, this community is perfect for business and leisure travel. Enjoy resort-style amenities and services - pool, tennis courts, billiards room, on-site dry cleaning and fitness center - without the resort price tag.",2
"My place is located in the heart of foggy bottom (just a 5-min walk to the Foggy Bottom Metro Station. Youll love my place because of its dcor, coziness and amazing views from its private 400 sqft terrace. My place is good for couples and solo adventurers. @",0
"Hello everybody and thank you very much for your interest in my place, I will try to offer you the perfect place to have a good time. Great studio in Upper West Side, 10 minutes from Times Square, 3 minute walk to the express subway going downtown I live in a really nice, cozy one bedroom apartment in the Upper West Side of Manhattan.  The bedroom has a queen bed and the living room has comfortable seating.  The floors and carpet are immaculately clean all the time and I like my space very tidy.  I am a private piano instructor so my space is put together and well decorated.",1
"My place is close to The Beach, breweries, South Bay dinning & shopping. Youll love my place because of the ambiance, the comfy bed, the pool, and the patio.. My place is good for couples, solo adventurers, business travelers, and families (with kids). @",2
"Spacious 1BR in great neighborhood right on Greenpoint/Williamsburg border. Queen sleeper sofa. Elevator building. Full-size kitchen, breakfast bar, tons of cooking gear, nice stereo & TV, slate floors, Juliet balcony ... even a washer/dryer right in the unit! @",2
"Youll love my place because of the location, the people. My place is good for solo adventurers and business travelers. Private room in a 2 family private house in Sunnyside. The apartment is on the 2nd floor and has 3 bedroom two of which are occupied with international students for a long term stay. The kitchen and bathroom are newly renovated and shared by current occupants. The room has a queen size bed, two nightstands, night lambs, and a walk in closet with drawers, clothes bars, a table and chair for personal/work related uses. There's wireless broadband, satellite TV with Apple TV in the living room. The house is only 3 blocks from the 7 train which then takes about 10-15 minutes into Manhattan.",0
"This is old victorian style house. House is 110 years old, historic house. Located in DOWNTOWN LA. Great location. Room is very small, but private room, its located near the main entrance of the house. Has own entrance and own keys and lock. Nice area with palm trees and lots of cafee and bars in our area, safe neighborhood. My family also live here and we have no problem within 3 years!!!! Near the house has 6 bus stops and 2 metro stations. Please, DONT BOOK IF YOU SMOKE MARIJUANNA!!!! Dear guest! We have prepared for you a description.  The house  is located in the heart of Los Angeles, 12 minutes from Hollywood. It is a densely populated area where there are many restaurants, bars and shops. Sometimes there can be noisy, as in all large cities. From our region easy access to all attractions of Los Angeles, as the geographical area is located in the downtown. Our house  - it's a big old three-storey house with spacious bathrooms and large windows. We made repairs in the house. The bathroom and toilet are located on each floor. Bathrooms renovated. Housekeeping twice a day cleans bathrooms. On the ground floor there is a reception and information boards.  The house has wireless internet access 100 Mb. Login Sony PlayStation 4 Password California. In three minutes from the house on Pico Boulevard there are many bus stops. By bus number 33 takes you to Venice Beach and Santa Monica's famous. By bus number 30 takes you to the beautiful area of Little Tokyo. Metro Vilshe",7
"My lovely one bedroom apartment reminds me of a little slice of Paris + a taste of Brooklyn, in Los Angeles. Modern with European flair, in a beautiful, walkable neighborhood with equal charm. Griffith Park and many cafes are just across the way! Enjoy the tranquility and calm of a clean, cozy space. Records are here for your use and complimentary wireless Internet. There is no cable TV, however movies {DVDs} will be left for your viewing. Hopefully you'll enjoy the 53 miles of trails in Griffith Park right across the way, rather than staying indoors however! Full service kitchen for your use. No dishwasher. Please hand wash dishes.",1
"South Austin Gem near Stephenson Nature Preserve, coffee shops, bowling alley, bus line. SOco, Solo, South 1st. Beautiful high ceilings with natural lighting.  Spacious, yet SO cozy. Large space with great light. Master Bedroom Suite and Sunroom bedroom with own Bathroom. Small efficiency type kitchen amenities with microwave, hot plate and dorm fridge available and stocked with bottled water.  Ironing board and iron Extra blankets  Hairdryer  Towells/linens Shampoo/conditioner/soap",1
"A large and private apartment in the heart of Silver Lake. Walk to Sunset Junction for restaurants, coffee, and shops, or to the beautiful Silver Lake reservoir. This Silver Lake gem is not to be missed! Large and beautiful apartment in the heart of Silver Lake. Fully furnished, private, and equipped with spacious living room, modern bath, comfy bedroom, and stocked kitchen. Walk to Sunset Junction for shopping, restaurants, and sight seeing. The best location! Walking distance to everything in Silverlake: restaurants, shops, coffee, ice cream, you name it! This private and comfy apartment is newly remodeled and furnished, perfect for an urban retreat.   Features:  1 bedroom (with comfortable queen bed) 1 bathroom with shower/tub  open living room, with plush sofa large, fully equipped kitchen  air conditioning wi-fi  tv with cable DVD player The apartment is private, and I'll be available 24/7 if you need anything at all. There is plenty of street parking, and is close to many bus lines, and 10 min by bus / 20 min walking from the Los Angeles Metro (Subway) Red Line at Vermont and Santa Monica. The house is 30 min to 1 hour from LAX by car, depending on traffic.",0
"This is a very large 4 bedroom apartment . It's very close to the University of Chicago, Obama's house, and the Subway. My wife and I are friendly, helpful and offer exceptional service at an affordable price. The indoor and outdoor space is always clean, quiet & peaceful. It's located in a forest like setting. The neighborhood is very safe and has lots of free street parking. Our place is good for anyone open to sharing a room and meeting people from around the world. @",5
Wake up in the morning to the beautiful sound of birds singing in the Giant Yellow Oleander tree just outside of your room. Have a cup of coffee on your private balcony in this fully restored craftsman home in the historic neighborhood of Golden Hill. You are one block to the number 2 bus and approximately one mile to downtown San Diego. (A 20 minute walk) Your room is connected to the bathroom . There is also a refrigerator and a coffee maker and bottled water. Fruit and snacks are provided @,1
If the thing you love most about visiting to other place is the people. Then this is the place for you . I rent out 3 rooms in my house so people are always coming and going . Stay In a home that fells  like staying  with family . @,1
"Our cool and comfortable 3 bedroom apartment fits six and is centrally located on the upper west side, just 2 blocks to Riverside park and 4 blocks to Central Park. Enjoy a gourmet kitchen, roof access, and easy access to all major subway lines. @",1
"Historic Cabin on the Bowery sleeps one and has a small dresser.  Amazing location puts you in the heart of Nolita.  Access to two lobby areas and the rooftop garden. This Original Cabin has a trellis ceiling and the bathroom is shared. Your Original Cabin has a single bed, side table and a shared bathroom.  Complimentary WiFi is included and log in will be given to you at check in.  The cabin has a trellis ceiling which allows for the heating and cooling.  Your Original Cabin has it's own lock and key.  (Lost keys are 25)  Keys can be kept at the Front Desk while you are out for safe keeping.",4
"Just steps to the sandy beachfront at famous Windansea. Enjoy swimming, snorkeling, scuba diving, kayaking cave tours, sea lion encounters, and all that La Jolla has to offer. Dining and boutique shopping is a 10-15 minute walk. Del Mar, Gaslamp, Balboa Park 20 minute drive. Breakfast Included. NO SMOKING Super comfy Tempurpedic 3k mattress set for guest :) Stainless steel appliances and granite counters. High-speed Internet, TV, DVD. Home is only 1.5 blocks to the Pacific Ocean !! Beach cruiser bikes, skate boards, surf boards and other beach equipment can be rented at nearby locations.",2
"My apartment is close to the best Harlem restaurants and entertainment and just minutes away from all NYC has to offer. Youll love the high ceilings, exposed brick, convenient location, proximity to major sites, subways and overall real New York charm -- perfect for couples, solo adventurers, and business travelers. Youll love the high ceilings, exposed brick, convenient location, proximity to major sites, subways and overall real New York charm -- perfect for couples, solo adventurers, and business travelers.",1
"The Bashful Blue Room is located in the HQ of a glamorous cabaret dance troupe. The loft is a wonderland of nicknacks, costumes and props, in the true bohemian spirit. It's centrally located, has double-height ceilings, and oozes artistic charm. The Bashful Blue room is a private den of tranquility within the HQ of a glamorous cabaret dance troupe. While the loft is a wonderland of nick nacks, costumes, and props in the true bohemian tradition, the room is peaceful and windowless. Guests regularly emerge from the room and tell me that they just had the best night's sleep they've had in months.",5
"Furnished two bedroom apartment on second floor of two family home One large bedroom and one smaller bedroom Kitchen with microwave, dishwasher, stove and refrigerator Dining room with built in hutch Hardwood floors throughout Comcast cable/wifi European style washer dryer all in one @",0
" 2 Bedroom, 2 Bathroom High Rise Unit  This listing is for the entire unit  Modern furnishings and art  Views all the way from Tijuana to La Jolla   Pool, Hot Tub, Huge Gym and Cardio Room  Free Parking!! High Rise condo/apartment in downtown San Diego. This listing is to rent the entire unit. Complete with 2 bedrooms and 2 baths.  Very comfortable, yet modern, with a spacious balcony and expansive windows to maximize panoramic views, stretching from the Coronado Bridge to Balboa Park and the Airport.  This is a lifestyle of convenience! You will love the club room, fitness center, lounge and screening room, as well as a relaxing sundeck complete with a lap pool and spa. Located in the Upper East Village with easy access to the 94, 163 and 5 freeways allowing for convenient travel and commuting. We are just a few minutes walk from the Ballpark or Gaslamp District, Balboa Park and the Airport. You can even watch the planes fly by and land! We also provide FREE PARKING!",1
"Located across from Williamsburg Music Hall, our modern 1 BR apartment is perfect for your stay.   -5 minute walk to Bedford L train -Spacious living room and bedroom -Bar/Counter space for cooking/eating -Washer/Dryer/Dish Washer/heaters (2) Our space is nicely decorated with mid-century and danish style decor.  There are washer/dryer/dish washers in unit as well as heaters in both the bedroom and the living room.  We have a large counter that is perfect for cooking and eating.  Closet space will be available to guests.",2
"Make yourself at home with your German-Austrian hosts and cats in Staten Island! Your clean and safe private room is just in the right distance for a 60 minute commute to Manhattan and also to get some rest at home after a busy day. The comfy King Size beds in our retro home offer the ideal home base for your New York City trip. Both airbnb guest rooms as well as the kitchenette and the bathroom, which is shared with maximum two other guests, are located on the upper floor of our house. LIKES AND DISLIKES Maybe the easiest way to help you make a decision is, to list those things most people like or dislike about our listing: Our guests love: o to get some rest in a suburban area in reasonable distance to Downtown Manhattan  o the clean and safe home o the occasional interaction with their hosts  Some of our guests dislike: o if you have a very light sleep, you might hear other guests sing while taking a shower in the bath room next door o bathroom, kitchenette with pitched roof and relatively small hallways with steep steps are not perfect for large/tall fellows o we do not have a microwave o the location with a relatively long (60 min+) commute to Manhattan and only a few shops in the direct neighborhood  GUEST R",3
"A pleasant, convenient bedroom in a three-bedroom apartment in the heart of Park Slope, Brooklyn. You would share with two woman who live here full time. We are friendly, quiet and enjoy guests.   The neighborhood is near the subway (F/G/R) and Prospect Park. There are restaurants, bars and shopping located nearby. Meanwhile, our block is quiet and lined with trees. This is a small room, suited for one guest, with twin bed, AC, a built in clothing rack, a dresser and nightstand. The room has a twin bed, wardrobe(like a closet) and nightstand. Half of the closet will be available for your use. There is also a small table and chair to place your luggage. Bedding, towels, and good wifi are included. There is a window.",1
"My cozy one bedroom condo is perfect for 2-4 guests, located 10 minutes from downtown Denver in our hip Cap Hill neighborhood & is right next to Cheesman Park. Local bars and restaurants are within walking distance along with grocery stores. @",1
"Stunning views of the bay in a friendly, quiet neighborhood.  Comfortable home with theater room and children's playroom.  Freeway access is a breeze!  25 minutes from SF. Our house features: *Breathtaking views of the Bay from the Living Room and Play Room *Projector Screen T.V. with access to HBO, Local Channels, Netflix, Amazon Prime Video, Youtube, etc.  We also have a large selection of quality DVDs. *Eat-in kitchen with Oven, Microwave, Stovetop, and accessories like a   blender, French Press, etc. *Large Children's Playroom which functions as a nighttime bedroom *Large parking area, room for 3 vehicles. *ADT Security System and service for your peace of mind. Sleeping arrangements include 2 bedrooms and 3 common rooms that have sleeping arrangements built in: 1 King size bed 1 Full pullout bed 1 Twin pullout bed 1 Toddler Bed 2 Couches 1 Pack 'N' Play",1
Clean apartment with WiFi and a queen size bed. Easy access to ACBD subway 15 minute ride to midtown. @,0
"Come live like a New Yorker with a lifelong New Yorker! You'll be staying in a huge bedroom (14x14) with a large closet. Its an amazing sanctuary for anyone looking to have an amazing time in NYC.  The apartment is located in a prime Lower East Side location that's just walking distance from the best bars and music venues in the country. There's also a citibike kiosk right under your window, so in theory, you could jump out your window and land right onto a bike seat - but i would really prefer you didn't try that. Places that are just a quick walk away:  Clinton Street Baking Company, Katz Deli, Russ & Daughters, Mission Chinese, Meatball Shop, Ivan Ramen, Le Turtle, Il Bagatto, Welcome to the Johnsons, The Hotel On Rivington, Mercury Lounge, Pianos, Bowery Ballroom, Cake Shop, Hotel Chantelle, Williamsburg Bridge, Chinatown, Soho, East Village. This location is amazing. I work as a Music Director for a women's fashion brand, DJ, and used to run a record label and be a music magazine editor and twice published book author.  Guests will hav",3
"If you're going to visit Austin, you might as well do it in style. Walk to the SoCo District or enjoy a 3 mile cab ride to Zilker Park from this clean & updated 4 bed/4 bath home! Spectacular backyard, wet bar & rooftop veranda! Minutes to downtown! Location, location, location! If you're looking to be in the center of all the action, you've found your spot! Less than 3 miles from downtown Austin, within walking distance to South Congress and 3.5 miles to Zilker Park.",1
"Luxurious comfortable room 10 mins drive from JFK international airport 4 minutes walk to public public transportation. This luxurious room is clean,my house is located in a very good neighborhood , green acres mall . 20 minutes drive to far rock away beach.",1
"This beautiful apartment is located 1 block from the Famous Balboa Park, there is plenty of FREE parking around this area, best of all: Quiet Neighborhood and very SAFE.  HIGH speed Internet, Full Kitchen, Kitchen Basics b-fast free, Full Bathroom.. 1 BLOCK from Famous Balboa Park, biggest Municipal Park in the U.S where you can find the #1 Zoo in the U.S, many Museums, great walks and even hikes, all within walking distance from my apt. Great Restaurants all around.",1
"Cozy 1 Bd/1 Bth located in the heart of West LA. My place is close to Tender Greens Culver City, Downtown, Overland Cafe, The Culver Hotel, and Akasha. Youll love my place because of the location! My place is good for couples, solo adventurers, and business travelers. Please feel free to reach out to me with any inquiries you may have! @",3
"Cozy, comfortable one bedroom railroad, a block from Grand St L train. Steps to coffee shops, bars, restaurants and Cooper park.  Enjoy exploring the popular East Williamsburg location! Please feel free to email me with any questions. @",0
"Perfect oasis for STUDENTS, PROFESSIONALS, and VACATIONERS. We have served people from South America, Europe, and Asia so far. This is your new home your home away from home. *Complimentary coffee (with creamer & sugar) and tea *Wireless Internet  *TV *Netflix *Kitchen Use  *Central AC/Heating  *Washer use  *Dryer use *Smoking allowed in porch only. Thanks. Air mattress available upon request. Check-in time is listed at 1pm and check-out time is listed at 11am. We can accommodate your needs and will work outside these hours as long as it works with other guest schedules and our ability to have a clean and beautiful space for you to stay. We expect clean, respectful, and relatively quiet guests. Bonus if you're fun, interesting, and generally a nice person! Smoking must be done outside on the back porch. 2-min walk to BUS #4, #63, and #59 2-min walk to CTA GreenLine Train (Cottage Grove stop) 2- min walk to Divvy bike station (63rd & Cottage Grove)",2
"My place is close to Barclays Center Prospect Park A,C,S,G Subways 20 minutes from Manhattan Many restaurants, grocery stores, coffee shops , Peaches Hot House, Alice's Arbor. Youll love my place because of the light, the comfy bed, the coziness, the space! My place is good for couples and solo adventurers. @",1
"The Blue Pelican Beach Rental is a 2bd/2ba beach cottage 50 ft from the sand in Mission Beach, CA. Come enjoy the surf, sand, & sun provided by the Blue Pelican The Blue Pelican Beach Rental is a classic 2 bedroom/2 bath beach cottage, just 50 feet from the sand in the heart of Mission Beach. Enjoy the surf in the Pacific Ocean or water sports on Mission Bay. Once you land at the Blue Pelican you can park the car and enjoy the ease of beach life. A classic 2 bedroom/2 bath beach cottage in the heart of Mission Beach. It's extremely walkable with great restaurants and lots of options for fun activities. Walk or bike anywhere you need to be.",0
"Spacious happy summer house:mid century designer furniture, art everywhere, full of sunlight, plenty of storage, wooden floors, new kitchen, two gardens, outdoor dining area, two large TVs with netflix, new bedlinnen and towels. Bikes to borrow - close to everyting that Venice offers: beach, street life, restaurants, coffee shops, yoga, abbott kinney, rose av, whole foods. Its on a quiet streetbut super close close to all the hip of the hood. @",0
"Charming Spanish bungalow, walking distance to trendy York blvd. There is a master bedroom with a memory foam Queen bed, which has a private en suite bath, a separate den with Queen pull out bed, & another office with a comfortable double futon bed. These rooms share a full bathroom. Relaxing backyard. Light-filled bungalow with three large bedrooms, plus a spacious living / dining area and fully equipped kitchen.  You can walk to everything from here - brunch, coffee, vintage furniture & clothes, records, gourmet ice cream & donuts, hipster pizza, you name it, it's around the corner on York blvd. Enjoy the ease of going carless in LA!",1
"In search beauty and comfort? You have found it!  With an en-suite bathroom and outdoor patio space, you will find all the pleasantries needed to enjoy your stay. No SMOKING. No parties or events. No UNAUTHORIZED guests. A calm, serene and airy, with beautiful patio space.  Guests have exclusive use of a bedroom, private bath and balcony.   A hotel-like atmosphere with a totally at home feel. Hallways and outdoors are security video monitored",2
"My place is close to Blue Ribbon Sushi and other great SoHo restaurants. Youll love my place because of the neighborhood, the kitchen, and the comfy bed. My place is good for couples, solo adventurers, and business travelers. More photos upon request. @",0
The Diamond Suite at the 11th Avenue Inn Bed and Breakfast. @,0
