text,label
"You will be reserving 1 bedroom in our newly listed 3 BD house. Sits on the intersection of Elston and Rockwell. We are in the middle of it all. You can shoot into downtown quickly or be in Wrigleyville within minutes to watch the Cubs. Youll love this place because of the neighborhood and privacy. The space is good for any size party and has been crafted by a well experienced host, its a gem. If your looking for a 1 or 2 Bed Room apartment please look at my other listings. You will have a private bedroom while sharing a sunny dining room, chill living room, and 1 bathroom with other guests. There are 2 other bedrooms that may or may not be occupied in the house. All bedrooms have their own locks on the door. If you need to reserve the entire home, please refer to that listing which you can find on my profile page. Only a few stairs up from the sidewalk and you are in the house that was built in 1892. The look and feel of the house is true Chicago vintage. You have all the privacy you need. Crack a few brewskies on the large deck and put some burgers on the grill in the backyard and relax. Hardwood floors in the living and dining room add to the retro feel.  Each bedroom has a large closet, full size bed, night stand and dresser. Create a huge breakfast for your group in the large kitchen that has lots of cabinets and storage space. Plenty of closets throughout if you are a traveling band or in Chicago for work and need a temporary place for your equipmen",1
"Master bedroom in a 4br/4.5 bath townhouse in the heart of Adams Morgan. King sized bed, private bathroom and walk-in closet. Central location surrounded by restaurants, bars and parks. Master bedroom available in a great 4br/4.5 bath townhouse in the heart of Adams Morgan. You would have your own furnished room (king bed!), private bathroom and walk-in closet. This is a beautiful, modern apartment, friends are always ""wow'ed"" when they walk in. It is equivalent to having a one bedroom apartment but getting the amenities of a full house - roof deck, kitchen, fireplace, dining room, location, great people. Your bathroom has a double-headed shower, tub, heated towel rack and walk-in closet. Guests will be allowed full access of the house (kitchen, dining room, living room, roof deck) The other guests in the house are two twenty/thirty something women and a small dog that acts more like a cat (curls up and cuddles). It is usually in her owner's room but sometimes comes down to say hi. Non-allergenic. Adams Morgan has a great neighborhood feel in the city. We are a half block away from tons of restaurants, bars, 2 grocery stores and coffee shops. We are also walking dista",1
"We are offering one bedroom in our unique and fun home.  You will have full access.  Our backyard has a fire pit, hammock and dining area.  We are a family of three and will treat you like a visiting friend. The location is excellent. The space is hard to capture with pictures.  We are up high and face west.    There is an amazing breeze in the house throughout the day.  All of our floors are hard wood with rugs in some of the rooms.  We have a covered patio with a very cool backyard.  My husband is very creative and has several fun projects in the works such as an outdoor bar area and a putting green.",2
"**Note: I'm refurnishing this loft. Much of the current furniture is being replaced with new stuff in a different style. The loft you get will be the exact same one with a new decor. Since you're booking blind, you get a discount. Don't ask for photos! Not doing a photo shoot until I'm done.**  Comes with fast Wi-Fi, free Netflix and Hulu, and Apple TV. Beautiful loft in the heart of Downtown LA, close to the Convention Center, nightlife, metro stations, and amazing shops and restaurants. If you've ever been to New York and seen the lofts there, you'll know what this place is like. High exposed ceilings, bare cement floors, and a cool industrial vibe. While most lofts are big wide-open spaces, this one is neat because it has a dedicated bedroom, which is nice for those who want added privacy. It's clean and well-organized, and it's got a solid view of the downtown skyscrapers.",10
"Beautiful apartment, in a nice building. My apartment is spacious and well lit by natural light, from several windows. You have access to the living room, kitchen and bathroom. This room has a full size bed and can accommodate another person with a queen size airbed that I provide.  In this spacious and very sunny room there is Wi-Fi for access and access to a closet near.  From your bed you can watch cable TV too..  You can lounge in the room on a couch.",2
Cozy studio in Adams Morgan/Columbia Heights area. Less than 2 miles from the White House and an easy bus ride or metro ride to areas local attractions. Will be adding more photos soon. @,0
"Private, light-filled, quiet, top studio in a classic Edwardian with expansive views of San Francisco and a rooftop deck.  Located between charming Cole Valley, historic Haight-Ashbury, and within walking distance of Golden Gate Park and UCSF. This modern rooftop unit is in a gorgeous Edwardian building.  The unit has a bathroom, queen bed and large deck with expansive views of San Francisco.",6
"This apt isnt for everyone - its for rebels with causes, cool kids that didnt need to be called cool, the ones that are different, the make-up-their-own-mind type, those that want to be part of the action, but not in the middle. Adventure seekers! Adventure seekers, as some call them.  This is an older apartment and it comes with everything you'll need for a comfortable stay: Wi-Fi, Free Breakfast, Fresh Towels, Hair Dryer, Body Wash, Lotion etc. Luxurious & sleek apt in amazing location! Mins from downtown-Chicago.  The guest bedroom has a modern, luxurious and super comfortable queen sized West Elm Henry Sleeper-Sofa.  Guests can use the entire apartment, private deck, grill, kitchen. Free street parking! Official Walk Score: 88/100 (Very Walkable) Official Transit Score: 66/100 (Good Transit)",1
"This private room in our 4 bedroom, 1.5 bath Victorian home sits just below Twin Peaks in Noe Valley, the sunniest area in SF.  Our cute neighborhood has restaurants,  shops/boutiques, grocery store, and transportation all within 2 blocks. Come experience the sunniest neighborhood San Francisco has to offer in our cozy & quiet, four bedroom, 1 bath Victorian in the heart of Noe Valley. This beautiful home sits just below Twin Peaks and is just two short blocks from the great shops and restaurants in Noe Valleys 24th street shopping district, which includes an eclectic variety of boutiques, shops, restaurants, bars and coffee shops. The BART (Bay Area Rapid Transit) station and Mission and Castro Districts are all within a 20-minute walk, and public transportation to Downtown SF is just  block. Interstate 280 and 101 are less that a 10-minute drive and its only 20-minutes to SF International Airport. The house has clean lines, high ceilings, bamboo floors, cozy floor plan with a great flow. An updated kitchen with a dining area that is perfect for entertaining while preparing meals. The kitchen has a gas range and oven, microwave and appliances, plenty of storage space and a refrigerator. THE BEDROOM:  ~Noe Valley Roo",2
"Hi! I have a large studio/one bedroom apartment. I say studio because the bed separated but in the same room as the sofa and tv.  There is a separate room for lounging and dining. Full kitchen. Lots of sunlight and space The apartment is located in greenpoint. You are close to all the bars and shopping in greenpoint and williamsburg, its about a 20 min walk from almost anything. Manhattan is easy to get to, about 30 mins with a train ride and short walk.  Bars, restaurants and art of bushwick is 15 min walk down the street.",1
"Located 15 minutes from downtown in desirable Circle C Ranch.  4 Bedrooms, 2.5 baths.  Master Suite, Jacuzzi Soaking Tub,  Outdoor deck and private pool.  Includes parking access to downtown parking across from Convention Center 24/7. @",0
"This stand alone barn is well lit with sixteen feet high ceilings, skylights, and a sliding barn door. It has ample storage for a weekend get away, with coffee maker, toasteroven and an awesome full bed. SHARED BATHROOM in main house. More amenities. This space is ideal for a couple or single person traveling lightly and for a quick stop off. It has an excellent full sized bed in it, a small fridge and a coffee maker, and a small toaster oven. It is not set up for making large meals, or cooking in a kitchen setting. We have two cruisers for use during day, and shared bathroom. Only one in house...:) We also have two doggies that are deeply affectionate once they initiate you by barking a few times. Don't worry, they won't interfere with your space, but if you like dogs, and petting them, you may have two friends by your side as you soak in the backyard...",5
"Hi! Live like a local!   My studio is a sunny, warm, cozy home away from home!  It's located in the heart of NYC!   I'm happy to help u personalize ur trip with tons of ideas!  Sure it's a share, but I'm helpful in making sure u get the most out of NYC. U  won't be wondering what to do next.   It's perfect for the solo female explorer!  I've traveled alone myself & I know what that's like.   ! Hi! Centrally located apartment that is in the heart of everything!   It's near The Highline, Chelsea Market, Flatiron Building, Chelsea Galleries, The Whitney, Jacob Javits Center, Times Square, Madison Square Garden, Macy's, Billy's Bakery, West Side Highway and more!  ! I'm currently working from home during the day.  The apartment faces the street and it's usually quiet, but occasionally, as the weather gets warmer, there may be more noise and activity outside. You'll have run of the apartment. I'm available to help you during your stay.  I love this city and love for others to enjoy it fully.   I'm happy to guide you and help you make the best of your trip while in NYC when I have time.  10Airbnb! 2! My apartment is centrally located to everyth",3
"It is a spacious cozy apartment  located in the heart of Downtown, minutes away from Convention Center, restaurants, bars, shopping mall, Petco Park, seaport village, grocery stores, Balboa Park, and San Diego Zoo. It is a spacious cozy apartment right in the Gaslamp Quarter of San Diego. In your accommodation you will have a private room with a queen size bed, closet, desk, and your own private bathroom with toiletries and towels. Feel free to store your food in the fridge and use the kitchen and living room area. Also, I have recently adopted a little Maltese puppy. She is hypoallergenic and very sweet and quite.",9
"You can't get a better location! This bright, sunny studio is in the heart of DC in the vibrant Adams Morgan neighborhood. On Calvert St., steps away from tons of restaurants and nightlife on 18th St.. A short walk to the red line metro (Woodley Park) and multiple bus routes within 1 block for easy access to all the sites of DC. Walk to Dupont Circle, U Street, Woodley park, National Zoo, and much more! You'll love the exposed brick, large windows, and charming historic building. This bright and sunny studio apartment boasts exposed brick, large windows, and a walk-in closet. There is a king size bed with a new memory foam mattress, soft sheets, and Laura Ashley bedding. There is a three piece bathroom with a bathtub and towels.  Cable and Wi-Fi are included, as well as a flat screen TV. The kitchen has basic cooking necessities, a moveable center island, and a dishwasher.   The unit has a lock box, an access code will be provided about 24 hours prior to check-in.  *For additional guests, we have another studio available in the same building. Message me for details https://www.airbnb.com/rooms/14353375?guests=1&adults=1&children=0&infants=0&s=IGZcqEbX",9
"Bright 1 bedroom apartment in the East Village and walking distance to tons of bars, restaurants, NYU & USQ.  Perfect if you're looking for the real New York experience.  Everything you could possibly need! @",0
"My place is close to Subways and Metro Stations!. Youll love my place because of the location and the neighbourhood. My place is good for couples, solo adventurers, and business travellers. @",1
"My place is good for couples, solo adventurers, business travelers, and families (with kids). Bedrooms: 3+1+1 Bathrooms: 2 House Size: 2,500 square feet Total Property Size: 10,100 square feet This is a gorgeous one story Ranch style home in the coveted Kester Ridge neighborhood near Sherman Oaks and Van Nuys Costco, resting behind a white gated fence at the very end of the cul de sac.   This 3 bedroom plus den has gleaming hardwood floors, 2 fireplaces, brand new double glazed windows, oversized 2 car garage converted to gym, sparkling fenced pool with plenty of front and backyard space to enjoy your Zen or garden space replete with humming birds as well as a basketball hoop in the front driveway.  Over 2500 sq ft on 10,100 sq ft lot. Conveniently located near restaurants, supermarkets, Ice Cream parlor, freeways, shopping and public transportation. Having your own car is recommended to get around Los Angeless sprawling metropolis and you can park it safely on the propertys private gated driveway. The location of the house at the end of the cul de sac in a beautiful, serene and friendly neighborhood that's conveniently located for all Los Angeles high spots or just stay h",0
"Home is a huge ""studio"", with a seperate kitchen, dining room, living room, front 'foyer', and a giant walk in closets.   It gets a ton of sunlight in the afternoon.   At the top of Russian Hill on a safe & quiet street, but is a 5 minute walk from 4 neighborhoods. Has a 55"" flat screen, 3k temperpedic mattress (it's amazing), bicycle, workout stuff, super fast wifi (I need it for work), piano / guitar / violin.  You're welcome to use anything. @",0
"@ FULL 2 BEDROOM APARTMENT on 3RD FLR Hey there! We have THREE BEDROOMS available in addition to this 2 bedroom apartment! Follow these links to see our other listings:  https://www.airbnb.com/rooms/979841 https://www.airbnb.com/rooms/979926  https://www.airbnb.com/rooms/979942  Please message us before making your reservation.  HABLAMOS ESPANOL! We (Lois & Eduardo, and our dog Leo Messi) live in a beautiful old Victorian in Chicago's Rogers Park neighborhood. Wood floors, lots of natural light, and a great atmosphere. We are on a 1 1/2 lot, so we have a nice side yard adjacent to the house, a big back patio, and a large wooden deck with a lovely pergola. We're hosts by nature and would love to share our home! Our cute labradoodle dog (Leo) will be sure to greet you and we guarantee you'll love your stay with us! My office (Eduardos) is in the home and I can help with anything you might need, or stay out of your way! Ive been in the travel industry for decades and can give tourists a",3
In the artsy and hip prime real estate  area of Alphabet City this vintage actually spacious original hardwood floors/ doors really colorful cozy apt is by everything one can think of and the culture of the city right outside your door. SWEET!! It's spacious  with good feel colors all around.,1
"Spacious, cute and comfortable apartment a half a block to the ocean in a quiet neighborhood in Ocean Beach. Just a few blocks away from the pier and main street with all the shops and restaurants. Lots of light and love. @",1
"Queen Bed, The room is 16' x 10'. Public transit in front of the house, gas stove, fast wifi.  Inner Sunset, close to Twin Peaks, Golden Gate park, DeYoung Museum, Science Museum, Haight. Couple Blocks from Cafe's, Restaurants. The chill vibe and  if you get a chance great conversation.",1
A beautiful escape in a wonderfully quaint and exceptional neighbourhood in Calabasas. 15 minute drive to Malibu! @,0
This is a bedroom in a 2-bedroom apartment. My roommates room is located on opposite side allowing you more privacy. You will also have your own bathroom located next to the bedroom and access to the living & kitchen area. @,1
"Centrally located in a quiet neighborhood in Rampart Village between Silver Lake, Westlake, and East Hollywood. Very close to grocery stores, bars, and popular local eats. Simple and roomy one bedroom/one bathroom apartment that gets lots of morning sunlight. Balcony, full kitchen, shower and tub, and two tandem parking spots inside a remote-controlled garage. There is coin laundry available on each floor, as well as trash chute for disposing garbage.",0
"In the heart of the West Village, in a tree lined street, SO quiet inside. Close to The Spotted Pig, Magnolia Bakery, The Meatball Shop, Extra Virgin - Literally so close to the meat packing and chelsea, bleecker street shops, all the small bars and restaurants, The Jane Hotel, Employees only, and right on a train line at 14th street to head into town. . Youll love my place because of the neighborhood, the coziness, the peace and quiet. My place is good for couples and business travelers. @",0
"Our 2 bedroom apartment is located  2 mile from beautiful Santa Monica beach. Our master bed room is big and very comfortable with a private  bathroom . We are located near Santa Monica blvd , walking distance to many resturant a and public translations . We are only 15 minutes from LAX. @",3
"Large bedroom in spacious apartment, located in the heart of hip Williamsburg: tons of amazing places to eat, cool bars and cute boutiques. Ideally located next to several subway lines (L, G, J, M, Z), Manhattan is just a few minutes away! Please read the full description and message with any questions. Hope to see you soon! The apartment is located on the top floor (second floor) of a walk-up building (no elevator). All the rooms of the apartment are really big for New York standards and the apartment is quiet. It is a two-bedroom apartment. I occupy the second bedroom so you will be sharing the common areas with me. Your bedroom is located in the back of the apartment. It has a comfortable full size bed, a night stand, a big desk and comfortable chair if you want to work/study, and plenty of shelves for your clothes.",2
"Modern, spacious, sunny apartment in a great area, one subway stop from Manhattan's Grand Central Station (no 7 trains). Partial river view.  Luxury amenities.  Supermarket and pharmacy right downstairs. Gorgeous waterfront park and lots of bars and restaurants nearby. One of NYC's nicest neighborhoods, short walk to Brooklyn, commute to Manhattan is a few minutes. @",0
"One bedroom/one bathroom apartment in West Nashville. Queen sized bed, one full sized couch, a loveseat, and an air mattress if you need more sleeping space. Located near target shopping outlet and good food/drink. @",1
"Mochi (my hypoallergenic pomapoo pup) and I have a gorgeous apartment near Columbia University. (Hablamos espaol!) Tidy, quiet with high ceilings and every amenity you could ask for including a queen sized bed (furnished photos coming)! Walking distance to A,B,C,D,1,2,3 Trains. Queen size bed in room with access to shared balcony and its own closet! Wood floors throughout, brand new, washer and dryer in unit, common patio, this is as spacious as it gets in NYC you will not be disappointed!",3
"My place is close to MoMA PS1, Grand Central Station, East Manhattan, ,Gantry Plaza State Park, Le Parisien. Youll love my place because of Walking distance to Subway Station which takes you to 7 Train. First stop is Grand Central Station in Manhattan. It takes 10 minutes to go to the city from my apartment. There are over 30 restaurants and bars all within the same block. Located by east river, the apartment is facing Manhattan. You will enjoy the sunsets right next to the river area.. Manhattan View, right by the water, 24 hours access to the gym, swimming pool, (available from May 15th-Sept 15th) Brand new apartment",2
"My place is close to public transport, parks, and the city center. Youll love my place because of the location and the ambiance. My place is good for couples, solo adventurers, and business travelers. @",5
"Steps from Abbot Kinney and 4 blocks to Venice Beach, this contemporary, private bedroom and bathroom is quiet, clean and bright with a chill vacation vibe. If you want to be in the heart of hip, look no further! The brand new Sealy queen bed has high-quality linens with an all-season comforter/quilt. There's closet space for you and the dressers are yours to use while you visit. The room has a 50-inch television equipped with a Roku for watching movies, streaming Netflix, Hulu, HBO Go and Amazon Prime. Wi-Fi is included. All towels and linens included. The room is very quiet since it is away from the street. If you get cold, there's a room heater and if you get hot, there are two fans or you can open the window for a nice ocean breeze. You have your own full bath with a skylight just outside your bedroom door as well as an added privacy screen so you can make your space even more private. We have two doggies who will not have access to your ""wing"" of the house. You'll notice them on your way in as they will bark upon greeting you but are mellow once you settle in. Your entry is through the front door and straight up the spiral staircase. This complex is a multi-unit property, with ours being t",1
"My place is close to (PHONE NUMBER HIDDEN)freeways, walking distance to coffee houses and major stores. Weekly farmer markets... Close to Studios, Malls minutes from Bevery Hills, Century City without the traffic, Sharky's Woodfired Mexican Grill, Ralphs Pharmacy, Ralphs. Youll love my place because of Great location, very quiet but in the heart of Sherman Oaks, minutes from Studio City and Burbank, great tree street lined and off street carport parking and on street parking & the neighborhood @",0
"@ Looking for a quiet, private, affordable room with own bathroom in the heart of one of Brooklyn's most iconic neighborhoods? Then look no further!  [PLEASE NOTE: I would appreciate it if you contact me first before submitting a booking request. Since it's our home I like to hear a little bit about you before confirming a reservation. Thanks :-)] Summary  Large and comfortable private room with own entrance and access to beautiful garden  Modern bathroom all for you with rain shower and steam facility  Sleeps 2 on a double futon bed, can accommodate two children on a double airbed   Children's books and toys available on request  Small fridge stocked with milk and fruit juice  Kettle, selection of teas plus basket of fruit and cookies on arrival  DVD, iPod dock, Wifi  Iron and table top ironing board  Books, maps and walking cards on New York  Central location near 12 subway lines, 15 mins to Manhattan  Free parking on the street  Overview We are offering a very large, clean",2
"This 3 bedroom unit is adjoined to a 2 bedroom loft that may be connected if need be. More photos to come for this luxurious location, but refer to ""Spacious Loft In Historic Building"" to see the comparable 2 bedroom. @",3
"Located in  West Logan Square close to the new 606 Elevated Park/Trail.  Relax and enjoy our great city in this cozy, classic Chicago style apartment. This private apartment is on the second floor of a 2-Flat building on a quiet neighborhood street. This 2 bedroom apartment that is the perfect way to visit our amazing city! It's located on a tree lined street in West Logan Square .  It's the perfect place to relax after exploring Chicago all day.  One bedroom is a queen bed, and the second bedroom has a full bed, there is also an air mattress available for extra guests.  There is 1 full bathroom and a full kitchen.",6
"15' ceiling exposed brick historic industrial loft with patio gives you quick access to all that Denver has to offer. 5 Minute walk to Lodo, Parks, Highlands, & Union Station/16th Street Mall. Quick access to i25 & only 30 minutes from the mountains. Comfortably fits 2 but can easily accommodate 4 with the couch and plenty of floor space to set up the air bed. This wide open loft is located in the heart of downtown Denver, but still close enough to the highway that you don't have to deal with inner city traffic. Easy walk/cheap cab ride to bars and clubs, Coors Field, Pepsi Center, walk to parks, highlands, be sure to check out the Art District on Santa Fe during first Friday of each month if you are here during that time.",2
This 3 story home is bright and spacious. We have a private garden with a BBQ and an outdoor table and chairs. @,1
"Brand new space on the border of Alberta Arts and Beaumont -Wilshire.  Just 15 mins to Downtown/ Pearl District and the Airport.  Walk to great shops and restaurants on Alberta St, Fremont, Killingsworth and 42nd Ave. Great location for visiting all areas of the city and getting out to the coast, the valley wineries, or the gorge for hikes. Private entrance, high ceilings, great lighting, and bright colors makes this a cozy---not basement like ---home.  Large Egress window for natural light. Brand new open concept space, inspired by my own travels.  Colorful and eclectic furnishings.   Large living area with cable TV.  Lite Kitchen and eating  nook. Queen size Sleep Number bed and walk in closet with plenty of hangers. Private in suite bathroom has a great new tile shower and all the essentials you'll need.  We don't have a tub....just a shower. Washer/ Dryer Desk Heat & AC Hair Dryer, Full length mirror, iron Easy street parking in front of the house Coffee, tea, creamer, water, yogurt and/or muffins and snacks ready for your arrival.",7
