text,label
"Located nearby Kissena Park Flushing, lake inside. 2 mins walk to Buses Station: Q27, Q26, Q65 which go to subway to Manhattan. Driving: 25 mins to JFK, 15 mins to LGA. 1 Hr to JFK by bus: Q65 transfer to JFK airtrain. : sunshine-babycare. 2 blocks walking to kissena Park to enjoy the beautiful Kissena lake view. There are golf course and 8 tennis courts on Kissena Park. Besides, there are basketball courts and baseball field.  2 minutes walking to Chinese, Korean, Italian, Latino restaurant, Landry room, Pizza store and various of other shopping stores.  Guests will have access to a full bathroom which is in the common hall. The bathroom may be shared with other 1 or 2 guests but is not used by the host. Fridge, microwave and hot water pot, etc are free to use. Me and my family is living downstairs, so we are seperately with the guest. I will interact as much as the guest wishes. Communication via AirBnB system preferred. Queens is a very diverse part of New York City. Flushing is particularly diverse with Chinese and South Korean community. Flushing centrally located and provides easy access to all parts of NY. The 7 train out of Main Street Flushing takes you to midtown Manhattan in 30 Minutes and faster with the expr",2
"This is a gorgeous modern unit on the top floor with beautiful view.  It has high-ceilings and large windows which brings in a lot of natural sunlight.The unit has internal heat and A/C, updated appliances (washer and dryer), 3 large TV's, modern furnishings, etc.  The price may vary depending on the days you request. The apt is a spacious newer built in 2004 located in the Fenway neighborhood. It is also centrally located, so you may choose to walk to Brookline/Coolidge Corner, Back Bay, the South End, and pretty much any other part of Boston. Faneuil Hall and the North End are slightly further to walk to, but you should do it! The Green line T station is minutes away. It is a gorgeous walk through the Newbery street, Boston Public Garden, Boston Common and Beacon Hill. You will also have access to our Cable (HBO, Showtime, and more), Netflix and WiFi.  Getting here from the airport - You can choose to take a taxi (usually around a 25 ride), or take the ""T"" for free. To take the T you have to take the Silver line from the airport to South Station, where you will take the Red line inbound to Park St, and switch to the Green line towards Kenmore. You may get off at Fenway about 5 minutes to reach the condo building.",1
"Enjoy one of the quietest streets in the city with unmatched views of Seattle's waterways & mountains, you can enjoy dining inside or out (2 decks), strolling through the historic neighborhood & parks or visiting Seattle's best minutes from our door. This four story Craftsman home is perfect for a family or two to stay in and relax or enjoy unmatched access to downtown, University of Washington, Husky Stadium, Bellevue/Redmond, biking trails, parks, medical centers and a handful of unique Seattle neighborhoods.  Indoor/outdoor dining will be a wonderful option with breathtaking views from our 4th floor deck off the ensuite master bedroom.   Our home is surrounded by wonderful neighbors, parks and restaurants.  You can easily access the ""most popular, must see"" spots Seattle has to offer, but will also experience countless hidden gems right out our front door. Near bus line and close to downtown and freeways.",0
"Cozy room in West Seattle has a partial view of the city over Harbor Island. The home is situated on a quiet dead end street near the Longfellow Creek watershed, Camp Long, and the West Seattle Golf Course. Bathroom and room is recently remodeled. Despite the fact this home is in the city it is a quiet space. Even the dogs are quiet (mostly), cuddly, and crate-trained. The room faces North toward the city, giving you cool, blue, relaxing light throughout the daylight hours.",0
"@ Quiet, cozy bedroom in a sprawling, sunny three bedroom Lower East Side apartment. Room amenities include: *Full Size Bed  *Dresser  *Night Stand  *Fresh Sheets and Towels  *Hair Dryer  *Ironing board and Iron  *Air Mattress available upon request Apartment amenities include:  *WiFi  *Large Common Space with TV/DVD player  *Kitchen (Cooking allowed)  *Microwave  *Refrigerator  *Full bath and shower We are within walking distance to Chinatown, the Village, the Financial District, and the bars and restaurants on the Lower East Side. Williamsburg, Dumbo, and Midtown are a short ride on the subway, which is a block from the apartment.",2
"Handsome arts and crafts 3 + bedroom, 2 full bathroom, fully furnished 1916 Old Portland home in the heart of Clinton neighborhood in inner SE Portland Backyard tiny house, which sleeps an additional 4 people (2 beds) is available for extra charge. Handsome arts and crafts 3 + bedroom, 2 full bathroom, fully furnished 1916 Old Portland home in the heart of Clinton neighborhood in inner SE Portland. Perfect for a family vacation, with plenty of common areas for reading, dining and relaxing. One queen size bed in master bedroom, a queen bed in second bedroom,  a full bed in third bedroom, and a day bed in attic studio space. Hardwood floors throughout, new appliances, yard, washer/dryer, and Japanese soaking tub. Includes Wifi, Apple TV, and all utilities. Two blocks from great restaurants (Broder, Savoy), cafes (Little Ts, Press Club, Roman Candle), bars (Dots, Clinton St. Pub, Richmond Bar), Bhaktishop yoga and Clinton St. Movie Theater. A few blocks from New Seasons, St. Jack, Pok Pok, Sunshine Tavern, Nuestra Cocina, Bar Avignon, Ava Genes, Block & Tackle, Sen Yai etc.  And the best artisanal ice cream at Salt & Straw. Three blocks from #4 Division St. bus, and 10 min. bike ride downtown. Elliott and Reiko are both History prof",1
"Charmed! It's Brooklyn life waking up in this airy loft bedroom and looking out through the sun filled music room over the Bushwick rooftops.  Living in the heart of the hipster scene,  you'll barely have time to enjoy the tall ceilings and wide open spaces of the 303 loft. The 303 is a spacious wide open loft space that will serve as the perfect home base to your Brooklyn and New York adventures.  Easy access to  the L and M trains will get you to the billyburg clubs and have you in and out of the city in a New York minute! This loft apartment is sun filled by two giant windows looking out to the east over the rooftops of Bushwick.  Enjoy your morning coffee sitting in a sunbeam, or hypnotize yourself in the evenings watching the line of planes flying in to Laguardia for the night. Fear not night owls crawling home from the show at Alphaville, or a rump shaking night at the Bossa Nova Social Club, we have massive wood shutters to bask you in shade as you nap away the day, or chill on 20 feet of couches before venturing back into the underground.  Upstairs in the bedroom you'll find a full bed with a new CB2 mattress.  Sleepy delight! Not interested in dining at one of the amazing restaurants in the hood? If you like to cook, we have you covered.  The kit",1
"GOOD NEIGHBORHOOD, NICE APARTMENT. FRESHLY PAINTED. THE BATHROOM & KITCHEN ARE CLEAN, MODERN & NICE. MIRRORED CLOSET, 40"" TV, WI-FI & PREMIUM CABLE. GARAGED PARKING IS FREE, BUT NOT SUITABLE FOR A MINIVAN OR LARGE SUV. THE FULL SIZE MATTRESS IS ON THE FLOOR. I'M GETTING NEW FURNITURE AND CARPET IN APRIL. SO I'M OFFERING THIS ROOM FOR A SUPER GOOD DEAL. @",10
"Basic Room with induction cooker, renovated bathroom, pleasant, shared backyard--perfectly adequate for a traveler seeking a comfortable crash pad with a 10 minute walk to and from West Oakland, and another 10-minute ride into the heart of SF. @",0
"My cozy home offers three spacious bedrooms with queen size beds. One bedroom has its own full bathroom attached and the other two bedrooms have a full bathroom in between. Open floor plan with a large kitchen, dining room, 2 living rooms and a covered back porch. The downstairs offers an open floor plan with kitchen, dining room and living room. Also downstairs is one bedroom with full bath connected. Upstairs is a large bonus room with comfy couches and a large TV. Two more bedrooms are upstairs, both have queen size beds and one of the rooms also has a twin bed. A full bathroom with a double vanity connects between the bedrooms. There is a covered backporch with a ceiling fan, music speakers and a seating area. Gorgeous pool in the backyard.",2
"A 5 min walk from every T stop in Boston and located just off of the major Cambridge St, with high ceilings and in unit laundry make this newly renovated condo your ideal vacation spot. You'd be renting out 1 bedroom and bathroom in this 2 bedroom unit. @",1
"Fully furnished, 1 bedroom + 1 loft (which can serve as additional bedroom/office), livingroom, 1 bath apartment located on the upper floor of a  residential building with gated entrance; 10 minutes from the beach in Santa Monica and the UCLA. Fully furnished, 1 bedroom + 1 loft (which can serve as an additional bedroom/office), 1 bath located on the upper floor of a two story residential building with gated entrance available for sublet. Hardwood floors throughout, fireplace, air condition, 42'' flat screen TV (cable ready), internet available for an additional 60/month. 2 tandem parking spaces in underground parking (+ additional covered guest parking), laundry on site, a common area roof top terrace with a hot tub.  The neighborhood is residential but it is within walking distance of the vibrant Sawtelle Blvd. neighborhood with lots of restaurants, coffee shops, and supermarkets (Ralph's, Trader Joe's, etc.). It is 10 minutes from the beach and UCLA (access to the 10 and the 405 freeway is about 3 minutes away).",1
"Big, beautiful townhouse with parking. 10 minute walk from the Red Line, which will have you downtown within minutes for inauguration events!   Luxurious duplex townhouse that's ideal if you want to be close to the action AND get a good night's sleep. Top-rated restaurants a short walk away include Busboys and Poets, Brookland's Finest, and Menomale Pizzeria. Starbucks, CVS and grocery store within minutes' walk. Brand-new 1,200 square-foot townhouse. Two floors, with living and dining area on one floor and two bedrooms on the upper floor. Both bedrooms have ensuite bath. Lots of natural light streams in all day. Parking available for your use.",1
"Secluded yet centrally located, w/ stunning views of Hollywood Hills & Sign. We welcome you to be our guest. This 3,000 sqft, 3 bedroom, one-of-a-kind 1929 duples is situated in the exclusive Carthay Historic Preservation Zone. Close to many attractions including LACMA, the Petersen Automotive Museum, The Beverely Center, The Grove, & La Cienga Park. Available for small group stays, events and film/photoshoots. We also rent out individual rooms to respectful adults & creative types.  Eric @",1
"Amazing 1BR Size Loft Apartment close to UN, Grand Central and Midtown East.  Doorman Building.  Excellent value for those seeking luxury and location.  5 star space and furnishings.  Walking distance to clients/customers in Midtown Business District and Events at NY Grand Hyatt and Waldorf Astoria etc. Super Luxe Renovated Loft Apartment in Midtown East.   Suites with less space and amenities charge over 800 per night at hotels/extended stay properties in manhattan.  Please note: This apartment is for discerning guests that appreciate location, design, and high end finishes.  Listed price is a good value compared to hotel alternatives for the luxe furnishings and space available with this apartment.",1
"Lugares de inters: North Beach, Golden Gate Bridge, Lombard Street, Crissy Fields, Marina Green, Fort Mason, Presidio, Main Post, Coit Tower, Japantown, Pier 39, Union Street, Chestnut Street, Russian Hill, Ghirardelli Square, Cable Car Turntable.. Te va a encantar mi lugar debido a el espacio acogedor, la ubicacin, las vistas y la gente. Mi alojamiento es bueno para aventureros y viajeros de negocios. The neighborhood is one of the best in the area. Most of the iconic spots or touristic place are within a walking distance or a very short trip on public transportation. The most iconic of them is the Golden Gate bridge which is at 5 mins away from my place. You can get a very nice picture from here. There are no windows in the room. The room is located in the street level. So walking through the side alley will be needed.  And there is no lock on the room door but you can be sure that you won't be bothered at any time.",3
One bedroom available in a 2 bedroom condo in the University District. Building is very secure and safe. Bedroom has its own bathroom with a shower. @,1
"Hi - this one bedroom apartment is loft-like in a beautifully renovated building in the heart of downtown Los Angeles.  It's a very comfortable apartment with high ceilings and exposed brink that has everything you need - Wifi, Cable, a fully stocked kitchen and a washer/dryer.  Near all the best restaurants and the major museums downtown. @",0
"I welcome you to stay in a new luxury building with 24/7 doorman. Its only 1 stop from Manhattan on the express line. Many subway lines in the area are in a short distance walk (Q,R,B,A,C,2,3,F,4,5).  there are many restaurants in the area and a big grocery store 1 block away.  Youll love my place because of the outdoors space, the comfy bed, the fully equipped kitchen and the neighborhood. My place is good for couples, business travelers, families (with kids) and furry friends (pets). @",1
"We love this alcove studio, right in the heart of Gramercy.  Doorman building, 500 sq/ft, washer/dryer in bldg, tons of closet space, new kitchen. It's a few blocks north of the East Village, a few blocks south of Midtown, and 2 blocks from the East River.  There's also a parking garage conveniently located in the building, and big windows with city sunlight and views always streaming in.  Everything is super clean, and the location is great no matter where you're heading. This is a very cool, unique space with lots of sunlight and closet space - not at all an NYC ""shoebox.""  I rarely use the kitchen, so the new oven and fridge are almost untouched.  Everything is super clean and tidy.",1
"We are traveling most of December and would consider renting our apartment for a few weeks.  Some of the perks: + 800 sf apt in luxury doorman building + AppleTV & Roku + 60"" TV + Tempurpedic bed + In-unit washer/dryer + Keurig, SodaStream, etc. @",0
"Spacious 1 bedroom in the heart of the sunny Bernal Heights neighborhood.  It is blocks away from restaurants, shops, public transportation.  It has a living area, separate bedroom, kitchen, and a beautiful garden. The living area is spacious with a large desk.  The bedroom is also spacious with a large closet and a chest of drawers.  You can  relax in the garden on 2 comfortable chairs.  There is no TV. All cookware is stainless steel or ceramic.  I provide tea, coffee beans, coffee grinder, olive oil, strainer, etc., all the basics you would need to make a good meal.  I have some maps, and can offer a comprehensive knowledge of the city to help make your stay memorable.",3
"The apartment is a nice homey space located in the west Village of NYC with easy access to all major subway lines. It's very clean and the room being rented has everything you may need for your stay. This is a 2 bedroom apartment with a lot of character and charm in the heart of historic west village. It is on the 4th floor of a walk up building (so three flights up). There is a fully equipped kitchen and nice renovated bathroom as well. I am putting the second bedroom (pictured) on Airbnb for the first time. The room being rented has a new full size bed and a 42"" HDTV with cable and high speed internet and large closet. The apartment also has a nice dining room table which can also be used to work at if necessary. This apartment has been featured on apartment therapy for its decor and design and is a great place to stay if the space suits your needs.",1
"My place is right next to the Q train (400 ft from building), Prospect Park (15 min. walk), Union Square (30 mins by subway) and a block away from Cortelyou Rd. with coffee shops, restaurants, and daily essentials (grocery stores, pharmacy, laundromat, etc). Youll love my place because of the neighborhood, the afternoon light, and how easy it will be to get into Manhattan. My place is great for couples, solo adventurers, and business travelers. The space is a bedroom studio with attached living room, dinner/work table, kitchen, coffee bar, and bathroom.  This is a home that respects all backgrounds-regardless of race, religion, national origin, ethnicity, disability, sex, gender identity, sexual orientation or age--without judgment or bias. My main concern is to provide you with the feeling of being home. Your comfort, safety, and happiness in my apartment is the utmost importance to me and I will do everything I can to ensure you feel like you are staying with a good friend in NYC. * Please* treat my home as if it were yours; with love and respect. :)",3
"This home has panoramic views of the Pacific Ocean from all four floors. Recently remodeled, the home is modern, spacious, and comfortable. It has two master bedroom suites. The gardens and the hot tub bring the inside and the outside together. Pacific Overlook provides a refuge from the city with splendid views of the ocean, Golden Gate Park, and the Sunset District. On the top of the highest hill facing the Pacific, this home has panoramic views of the ocean from all four floors. The entertainment space is generous and open to the view, and the decks can host dining and hot tubing. Though the bustle of the city is just minutes away via train or cab, this home is nestled in the quiet side of San Francisco where hawks and hummingbirds are more audible than cars and people. This home has two master bedroom suites with bathrooms that are equally gracious. The third bedroom is on the garden and hot tub level, and spills out onto a deck overlooking the Pacific Ocean.",0
"A cozy private bedroom & private bathroom with organic bedding & linens, all natural body products, all natural carpet, top of the line air purifier, & water filter.  A flat screen TV w/Dish Satellite, Netflix, or Hulu, and high speed WiFi.  Wake up to Nespresso, tea, fresh fruit, and full use of kitchen. Walk to Tujunga Village, 5 mins drive to Universal Studios & CBS Radford, 10 mins drive to Warner Bros. Studios, 15 miles to Santa Monica or Downtown, centrally located. A comfy twin bed with organic bed linens!  This bedroom is cozy, relaxing, and you have your own private bathroom, inside your room!  It is also equipped with an Austin air purifier, which on the lowest setting you can barely hear, but if you turn it up, it makes for great ""white noise"" to help you sleep.  A closet with ample hangers for your things and a heavy organic blanket in case you're feeling chilly.  The bathroom is fabulous!!!  Enjoy a spa style shower w/all natural Alterna Shampoo & Conditioner, Jason body wash, Hempz body lotion, and organic towels to dry you off!  Your TV is equipped with Dish Satellite, Netflix, or Hulu, or feel free to bring your own Apple TV and plug it in!  Also included is super fast WiFi.  This bedroom also features all natural 100% wool carpet (so please no shoes).",5
"Our place is located near all the excitement of the booming Hollywood area including the new Tao nightclub and Netflix's brand new headquarters. As our pictures show we were just featured on Airbnb's Instagram Feed. We offer an attached garage for your parking needs. My partner has a background in hospitality as a former New York hotel owner and my background is in production and a project manager for residential properties.  Our eclectic home is filled with our travels finds of art, literature, cooking and music.  As an Angeleno, I love sharing all my local favorites and tips from mom and pop stores, boutiques, to high-end shopping and culinary cuisines.  This place is conducive for families (we have two children), writers, and anyone who wants privacy while staying in Hollywood.  Treat our home with love and respect as we would yours. The house has all the amenities and technology you will need including Direct TV with HBO and other movie channels, smart keyless lock entrance, and motion sensitive lights.",0
"A home away from home.Its a very cute and charming. full size bed (sheets and towels included).VERY CLEAN  You are welcome to use the kitchen. Located in Williamsburg, Br A home away from home.Its a very cute and charming. full size bed (sheets and towels included)Laundry next door. VERY CLEAN  You are welcome to use the kitchen. full size bed (sheets and towels included)Laundry next door. Located in Williamsburg, first stop on the L, J,Z.M 10 to 15 min walk. Close to Bedford av Amazing stores, restaurants and cafes Two guest max. No smoking and no pets.",1
Cozy room includes a doorway to the backyard and a cantina . One  additional bath are downstairs . And downstairs is an impressive Two-story high library. @,0
"Nice spare bedroom in two bedroom house.  Double size bed.  Enjoy use of entire house and patio. Quiet neighborhood but walk to clubs, restaurants, park, shops,  and convenient bus lines.  Easy free street parking.  Great base to explore Los Angeles! Like a real home and short walk to shops, clubs, parks, restaurants, Sunset Strip, etc.  If no car, you can take ONE bus 45 minutes to the Beach or Downtown Los Angeles.",5
"Only steps from Balboa Park, this classic but large 1-bed, 1-bath Craftsman Home is located in a Upgraded Charming Building and Neighborhood! Open plan living room and dining room with tons of natural lighting! Don't miss this charming rental! Walk out your door to a cafe, restaurant or the Park, or sit in the backyard and barbecue and relax...Only steps from Balboa Park, this classic but LARGE 1-bed 1-bath craftsman Home is located in a Upgraded Charming, Building and Neighborhood -great for a single, couple, parent(s)with one or two kids, OR also great for larger groups who want to stay together but have their own private space! Please inquire as there are 3 other units in this building that are available! An open plan living and dining room enjoys a flood of natural light from the many attractive and original large windows, and a classic, tiled kitchen is as functional as it is charming. This rentals hip location means you are minutes from numerous shops and cafes, with San Diego Zoo and several museums over at Balboa Park. At the end of the day, sink into a California King bed or watch the sunset from the outside patio. INSIDE THE HOUSE Built in a classic craftsman style, this charming home, built in 1911, has a light-f",1
"Cute two bedroom, one bathroom with many vintage features in the California Craftsman Style typical of the Rockridge area. Lovely residential area. an easy walk to College Ave, Market Hall, Rockridge BART This is not someone else's home!, 1100 square feet Cute two bedroom, one bathroom with many vintage features in the California Craftsman Style typical of the Rockridge area. Lovely residential area. an easy walk to College Ave, Market Hall, Rockridge BART, Bake Sale Betty's, Sunday Farmers Market, and numerous high quality restaurants. Trader Joe's 4 blocks away. Two miles to UC Berkeley, two miles to Lake Merritt and downtown Oakland Children's Hospital, Kaiser Hospital and California College of the Arts(CCA) close by. Lovely residential area yet so convenient to all freeways. Frog Park 1/2 block away with childrens structure,swings and large grassy area. We have a Pack & Play and high chair. Garage for parking. 250.00 Refundable Security Deposit this is a full house and not an apartment nor an in law unit.  Full kitchen with stove,oven,microwave, coffee maker, toaster,blender Full bathroom with shower and bathtub June, July & August and Holiday weeks, one week minimum This home is c",1
"My apartment is extremely centrally located in Chelsea, one of the most relaxed neighborhoods in NYC.  Perfect for singles or Couples. Steps away from The Highline, The Meatpacking District, Madison Square Garden and the Macy's Thanksgiving Day Parade and Broadway shows!    It is also close to Madison Square Park,  Union Square, the West Village and Barneys Downtown and the shopping on lower Fifth Avenue and Restaurants galore! Both the 1 and the C, E subways are less than a block away. My place is good for couples, solo adventurers, and business travelers. Separate 1 bedroom with comfortable Queen Bed. This is a 2nd FL Walk-up. Living Room has a sectional that can also function as a twin bed for duos wanting separation. There is one TV with Cable and Wireless Internet. Single Private bath with step-in shower. Kitchen with stove/oven, fridge and toaster oven.",2
"This Malibu retreat is located in the secluded enclave of the Serra Retreat. The four bedroom residence features antique hand plastered walls, hand carved limestone and walnut flooring, imported French fireplaces, hand sculpted doors, and custom ceiling details throughout. In addition to the main entertaining rooms of the home, there is a hidden screening room, a wood paneled office, and expansive backyard with pool. Guests also have access to the property's driver and new Mercedes Benz Maybach. @",0
